title,img,英文名称,批准文号,主要规格,用途,产品说明
安乐片,http://img1.pharmnet.com.cn/suppliers/product_cn/205048_1.gif,,国药准字Z4502228,,舒肝解郁，定惊安神。用于精神抑郁，惊恐失眠，胸闷不适，纳少神疲，对神经官能症、更年期综合症及小儿夜啼、磨牙等症状者亦可使用。,
碘化铵含片,http://img1.pharmnet.com.cn/suppliers/product_cn/205049_1.gif,,国药准字H45021251,,用于喉炎、咽炎、扁桃体炎等。,
消络痛胶囊,http://img1.pharmnet.com.cn/suppliers/product_cn/205046_1.jpg,,国药准字Z19993133,每粒装0.3g(相当于芫花条3g)，0.35g*48片。,散风，祛湿。用于风湿性关节炎及其他风湿性疾病。,
群益（抗骨增生片）,http://img1.pharmnet.com.cn/suppliers/product_cn/205020_1.jpg,,国药准字Z41022366,,补肾，活血，止痛。用于肥大性脊椎炎，颈椎病，跟骨刺，增生性关节炎，大骨节病。,
消炎片,http://img1.pharmnet.com.cn/suppliers/product_cn/205047_1.gif,,国药准字Z45022014,,清热解毒。用于上呼吸道感染的发热；支气管炎的咳嗽有痰及疖肿。,
银黄软胶囊,http://img1.pharmnet.com.cn/suppliers/product_cn/205028_1.jpg,,国药准字Z20060149,每粒装0.5克,清热、解毒，消炎。用于急慢性扁桃体炎，急慢性咽喉炎，上呼吸道感染。,
连蒲双清片,http://img1.pharmnet.com.cn/suppliers/product_cn/205042_1.jpg,,国药准字Z19993379,0.25g/片。,清热解毒、燥湿止痢。用于肠炎痢疾、疖肿外伤发炎、乳腺炎、胆囊炎等症。,
熊胆川贝口服液,http://img1.pharmnet.com.cn/suppliers/product_cn/205041_1.gif,,国药准字Z20026698,,清热化痰，止咳。用于痰热咳嗽，咳痰不止，咯痰不爽。,
复方左炔诺孕酮片,http://img1.pharmnet.com.cn/suppliers/product_cn/205179_1.jpg,,国药准字H32023077,,,
消食健脾片,http://img1.pharmnet.com.cn/suppliers/product_cn/205043_1.jpg,,国药准字Z51021413,每片重0.35g,消食，健脾，除积，理气，燥湿。用于脘腹胀满，伤食呕恶，小儿厌食，消化不良，脾胃虚弱。,
筋络宁软膏,http://img1.pharmnet.com.cn/suppliers/product_cn/205174_1.jpg,,国药准字B20040014,25g/管，塑管包装。,活血化瘀、祛风通络、镇痛消肿，可配合按摩治疗各种损伤、扭伤、各类痛症，对神经痛、关节酸痛、颈椎、腰椎疾病疗尤为满意。,
丝白祛斑软膏,http://img1.pharmnet.com.cn/suppliers/product_cn/205173_1.jpg,,国药准字B20020420,,活血化瘀、祛风通络、消斑防晒、白面抗皱、对黄褐斑、雀斑、老年性色素斑等色素沉着症均有满意疗效；对冻疮等血瘀性皮肤病有效。,
泰妙强（复方泰乐素可溶性粉Ⅱ型）,http://img1.pharmnet.com.cn/suppliers/product_cn/205205_1.jpg,,,100g：酒石酸泰乐菌素5.0g+强力霉素5.0g+乳酸TMP1.25g,抗微生物药。对霉形体及多种细菌均有抑杀作用。用于防治鸡慢性呼吸道病，禽出败、鸡白痢及大肠杆菌病等。,
四炎一毒清,http://img1.pharmnet.com.cn/suppliers/product_cn/205207_1.gif,,,100g×10袋/罐×12罐/箱,,
胃得安片,http://img1.pharmnet.com.cn/suppliers/product_cn/205170_1.jpg,,国药准字Z35020584,每盒36片,胃溃疡，十二指肠溃疡，急、慢性胃炎，消化不良，胃肠功能紊乱等。,
脉络宁注射液,http://img1.pharmnet.com.cn/suppliers/product_cn/205168_1.jpg,,国药准字Z32021102,10ml,清热养阴、活血化瘀。用于血栓闭塞性脉管炎、动脉硬化性闭塞症、脑血栓形成及后遗症、多发性大动脉炎、四肢急性动脉栓塞症、糖尿病坏疽、静脉血栓形成及血栓性静脉炎等。,
香菇多糖注射液,http://img1.pharmnet.com.cn/suppliers/product_cn/205172_1.jpg,,国药准字H20030131,5支／盒，2ml／支（含香菇多糖4mg）,本品具有益气健脾，补虚扶正的作用。,
脉络宁口服液,http://img1.pharmnet.com.cn/suppliers/product_cn/205169_1.jpg,,国药准字Z20000014,20ml/支，12支/盒,缺铁性贫血的预防及治疗用。,
洛索洛芬钠胶囊,http://img1.pharmnet.com.cn/suppliers/product_cn/205148_1.gif,,国药准字H20031151,60mg（按无水洛索洛芬钠计）。,1、下述疾患及症状的消炎和镇痛：类风湿性关节炎、骨性关节炎、腰痛症、肩周炎、颈肩臂综合症；2、手术后、外伤后及拔牙后的镇痛和消炎；3、下述疾患的解热和镇痛，急性上呼吸道炎（包括伴有急性支气管炎的急性上呼吸道炎）。,
立环（注射用长春西汀）,http://img1.pharmnet.com.cn/suppliers/product_cn/205151_1.jpg,,国药准字H20040937,10mg,改善脑梗塞后遗症、脑出血后遗症、脑动脉硬化症等诱发的各种症状。,
勒马回片,http://img1.pharmnet.com.cn/suppliers/product_cn/205145_1.jpg,,国药准字Z14021641,,清热润肺，止咳化痰，利尿通淋。用于肺痨咳血、咳嗽痰喘，小便不利，热淋涩痛。,
黄瑞香注射液,http://img1.pharmnet.com.cn/suppliers/product_cn/205143_1.jpg,,国药准字Z14020269,每支2ml,祛风除湿，活血化瘀，散寒止痛。用于风寒湿邪侵袭而致的风湿性关节炎、类风湿性关节炎引起的疼痛及坐骨神经痛等病症。,
吡拉西坦氯化钠注射液,http://img1.pharmnet.com.cn/suppliers/product_cn/205152_1.jpg,,国药准字H20046262,250ml：吡拉西坦8g与氯化钠2.25g,用于脑外伤、脑血管疾病等所致记忆及思维功能减退。,
咖啡酸片,http://img1.pharmnet.com.cn/suppliers/product_cn/205147_1.gif,,国药准字H37020537,0.1g,用于外科手术时预防出血或止血，以及内科、妇产科等出血性疾病的止血，也用于各种原因引起的白细胞减少症、血小板减少症。,
红花注射液,http://img1.pharmnet.com.cn/suppliers/product_cn/205142_1.jpg,,国药准字Z14021639,每支20ml。,,
金蒲胶囊,http://img1.pharmnet.com.cn/suppliers/product_cn/205144_1.jpg,,国药准字Z10950071,每粒装0.3g,清热解毒，消肿止痛，益气化痰。用于晚期胃癌、食管癌患者痰湿瘀阻及气滞血瘀症。,
延迪诺（阿法骨化醇胶丸）,http://img1.pharmnet.com.cn/suppliers/product_cn/205378_1.jpg,,国药准字H20010618 (0.25μg)；国药准字H20010619 (0.5μg),0.25μg；0.5μg,骨质疏松症。,
点舌丸,http://img1.pharmnet.com.cn/suppliers/product_cn/205141_1.jpg,,国药准字Z14021763,每10丸重1.25g。,清热解毒，消肿止痛。用于各种疮疡初起，无名肿毒，疔疮发背，乳痈肿痛等症。,
甲芬那酸胶囊,http://img1.pharmnet.com.cn/suppliers/product_cn/205345_1.jpg,,国药准字H33022500,0.25g×10粒×1板,用于轻度及中等度疼痛、如牙科、产科或矫形科手术后的疼痛，以及软组织损伤性疼痛及骨骼、关节疼痛。此外，还用于痛经、血管性头痛及癌性疼痛等。,
别嘌醇片,http://img1.pharmnet.com.cn/suppliers/product_cn/205374_1.jpg,,国药准字H31020334,0.1g,用于①原发性和继发性高尿酸血症，尤其是尿酸生成过多而引起的高尿酸血症；②反复发作或慢性痛风者；③痛风石；④尿酸性肾结石和（或）尿酸性肾病；⑤有肾功能不全的高尿酸血症。,
扑热息痛粉,http://img1.pharmnet.com.cn/suppliers/product_cn/205369_1.gif,,,,,
坦斯克（盐酸阿扎司琼注射液）,http://img1.pharmnet.com.cn/suppliers/product_cn/205375_1.jpg,,国药准字H20020376,2ml：10mg,用于细胞毒类药物化疗引起的呕吐。,
妇女痛经颗粒,http://img1.pharmnet.com.cn/suppliers/product_cn/205324_1.jpg,,国药准字Z20040123,每袋装5g,活血，调经，止痛。用于气血凝滞，小腹胀疼，经期腹痛。,
美达新（吲哚美辛缓释胶囊）,http://img1.pharmnet.com.cn/suppliers/product_cn/205371_1.jpg,,国药准字H10920055,25mg,用于①关节炎，可缓解疼痛和肿胀。②软组织损伤和炎症；③解热；④其它：用于治疗偏头痛、痛经、手术后痛、创伤后痛等。,
垂盆草颗粒,http://img1.pharmnet.com.cn/suppliers/product_cn/205341_1.jpg,,国药准字Z33021070,10g×10袋,清利湿热，有降低谷丙转氨酶作用。用于急性肝炎、迁移性肝炎及慢性肝炎活动期。,
和络舒肝片,http://img1.pharmnet.com.cn/suppliers/product_cn/205321_1.jpg,,国药准字Z20043267,每片重0.42克,疏肝理气，清化湿热，活血化瘀，滋养肝肾。用于慢性肝炎及早期肝硬化。,
利胆排石片,http://img1.pharmnet.com.cn/suppliers/product_cn/205317_1.jpg,,国药准字Z20043846,每片重0.43克,清热利湿，利胆排石。用于胆道结石，胆道感染，胆囊炎。,
葛山降脂颗粒,http://img1.pharmnet.com.cn/suppliers/product_cn/205322_1.jpg,,国药准字Z20030133,每袋装4克,活血化瘀，补益肝肾。用于治疗痰瘀阻滞兼肝肾不足引起的原发性高脂血症。症见头昏、胸闷、肢困、纳呆、腹胀、失眠、健忘、腰酸等症。,
丹皮酚软膏,http://img1.pharmnet.com.cn/suppliers/product_cn/205305_1.jpg,,国药准字Z34020837,每支装10g。,抗过敏药，有消炎止痒作用。用于各种湿疹，皮炎，皮肤瘙痒，蚊臭虫叮咬红肿等各种皮肤疾患，对过敏性鼻炎和防治感冒也有一定效果。,
蓝圆芪王注射液,http://img1.pharmnet.com.cn/suppliers/product_cn/205213_1.jpg,,,,本品能诱导机体产生干扰素，调节机体免疫功能，促进抗体形成。主治猪圆环病毒感染（仔猪消瘦、体重减轻、呼吸困难、水样腹泻）、蓝耳病（妊娠母猪早产、流产死胎、呼吸困难、体温升高、共济失调）、伪狂犬病、流行性腹泻及牛羊口疮、蹄部水疱溃烂、黏膜病，也可用于鸡传染性法氏囊病。,
球畅（家禽）,http://img1.pharmnet.com.cn/suppliers/product_cn/205212_1.jpg,,,,,
特攻,http://img1.pharmnet.com.cn/suppliers/product_cn/205211_1.jpg,,,10ml；1.0g,磺胺类药，主要用于敏感菌感染。,
激活Ⅱ（家禽）,http://img1.pharmnet.com.cn/suppliers/product_cn/205209_1.jpg,,,,本品由家禽必须的维生素、氨基酸、电解质等均匀配伍而成。用于提高鸡蛋的产蛋率、蛋质量和孵化成活率；对肉鸡后期生长能提供均衡的营养并提高饲料报酬率；能有效预防和治疗家禽的各种应激、营养缺乏、抗病率下降等。,
复方补骨脂颗粒,http://img1.pharmnet.com.cn/suppliers/product_cn/205232_1.jpg,,国药准字Z44022014,,温补肝肾、强壮筋骨，活血止痛。用于肾阳虚亏，腰膝酸痛，腰肌劳损及腰椎退行性病变等。,
冠心丹参颗粒,http://img1.pharmnet.com.cn/suppliers/product_cn/205233_1.jpg,,国药准字Z10970104,,活血化瘀、理气止痛、用于气滞血瘀、冠心病所致的胸闷、气短、心悸。,
福特加,http://img1.pharmnet.com.cn/suppliers/product_cn/205210_1.gif,,,,1.主要用于猪传染性胸膜炎、猪喘气病、猪肺疫、猪副嗜血杆菌病、猪萎缩性鼻炎，可消除高热发烧、呼吸急促、张口伸舌、腹式呼吸、食欲下降或废食等症状。2.控制蓝耳病、圆环病毒病、病毒性腹泄、伪狂犬病引起的继发感染。3.也可防止仔猪黄白痢、沙门氏菌病、牛呼吸系统疾病、乳房炎、棒状杆菌病、侮辱综合症、牛羊传染性胸膜炎、牛传染性鼻气管炎等细菌性疾病。4.抗应激，提高免疫力，增强食欲，恢复肌体营养平衡。,
柏子养心丸,http://img1.pharmnet.com.cn/suppliers/product_cn/205137_1.jpg,,国药准字Z14021727,每丸重9克,补气，养血，安神。用于心气虚寒，心悸易惊，失眠多梦，健忘。,
保和丸,http://img1.pharmnet.com.cn/suppliers/product_cn/205139_1.jpg,,国药准字Z14021535,每丸重9克,消食，导滞，和胃。用于食积停滞，脘腹胀满，暧腐吞酸，不欲饮食。,
胃疡安胶囊,http://img1.pharmnet.com.cn/suppliers/product_cn/205132_1.jpg,,国药准字Z43020510,每粒装35克,活血止痛，收敛止血。用于胃热痰痞，血瘀气滞，胃脘胀痛、胃溃疡、十二指肠溃疡及萎缩性胃炎。,
冠心宁注谢液,http://img1.pharmnet.com.cn/suppliers/product_cn/205135_1.jpg,,国药准字Z14020181,,活血化瘀，通脉养心。,
叶绿素铜钠胶囊,http://img1.pharmnet.com.cn/suppliers/product_cn/205133_1.jpg,,国药准字H51023474,,用于急、慢性肝炎的辅助治疗，亦用于白细胞减少症,
灵芝片,http://img1.pharmnet.com.cn/suppliers/product_cn/205671_1.gif,,国药准字Z44023584,,宁心安神，健脾和胃。用于失眠健忘，身体虚弱，神经衰弱,宁心安神，健脾和胃。用于失眠健忘，身体虚弱，神经衰弱。
冠心康片,http://img1.pharmnet.com.cn/suppliers/product_cn/205670_1.gif,,国药准字Z44022491,每片相当于原药材1克；薄膜衣片每片重0.18克,,甘木通为我国华南少数地区特有的珍稀药材，民间秘方甘木通治疗心血管疾病已有几百年的历史，具有药到病除之功效，广为称颂。为了挖掘民间医药宝库，造福人民，我公司组织科技人员与中国科学院华南植物研究所、广州市医药工业研究所等十六个单位共同对甘木通进行了近30年深入研究，证明甘木通确为防治心血管疾病的特效药物。康人冠心康片是民间秘方与现代科研结合的成果。采用现代科学方法提取甘木通的有效成分，精制而成的纯中药制剂，用于防治心血管疾病，特别适用于冠心病的治疗。1996年经卫生部组织的医学、药学专家组评审，进入部颁标准14册，获广东省优秀科技成果奖。
石淋通颗粒,http://img1.pharmnet.com.cn/suppliers/product_cn/205666_1.gif,,国药准字Z45020486,每袋装15g(相当于总药材15g)；,清湿热，利尿，排石。用于尿路结石，肾盂肾炎，胆囊炎。,
金龙丹颗粒,http://img1.pharmnet.com.cn/suppliers/product_cn/205662_1.jpg,,国药准字B20021032,10克*10袋/盒,补肝益肾、清肝明目、祛瘀化痰，降压、降脂。,主治：头目眩晕、手足麻木、神疲气短、失眠健忘、心胸憋闷等。
注射用穿琥宁,http://img1.pharmnet.com.cn/suppliers/product_cn/205627_1.jpg,,国药准字H20058681,0.2g,用于病毒性肺炎、病毒性上呼吸道感染等。,
夏桑菊颗粒(千福牌),http://img1.pharmnet.com.cn/suppliers/product_cn/205669_1.jpg,,国药准字Z45021127,10克*20袋/包,,
注射用甘草酸二铵(甘若纳),http://img1.pharmnet.com.cn/suppliers/product_cn/205626_1.jpg,,国药准字H20060491,0.15g,本品适用于伴有丙氨酸氨基转移酶（ALT）升高的急、慢性病毒性肝炎。,
板蓝根颗粒（千福牌）,http://img1.pharmnet.com.cn/suppliers/product_cn/205664_1.jpg,,国药准字Z45021498,10克*20袋/包,清热解毒。用于病毒性感冒，咽喉肿痛。,
注射用细辛脑,http://img1.pharmnet.com.cn/suppliers/product_cn/205621_1.jpg,,国药准字H20060547,8mg,用于肺炎、支气管哮喘、慢性阻塞性肺疾病伴咳嗽、喘息等。,
川贝枇杷糖浆(千福牌),http://img1.pharmnet.com.cn/suppliers/product_cn/205665_1.jpg,,国药准字Z45020458,100ml/盒,清热宣肺，化痰止咳。用于风热犯肺，内郁化火所致的咳嗽痰黄或吐痰不爽，咽喉肿痛，胸闷胀痛，感冒咳嗽。,
银杏叶片（邦杏通新）,http://img1.pharmnet.com.cn/suppliers/product_cn/205606_1.jpg,,Z20053913,19.2mg*24、19.2mg*36、9.6mg*24s、9.6mg*36s,活血化瘀通络。用于瘀血阻络引起的胸痹、心痛、中风、半身不遂、舌强语蹇；冠心病稳定型心绞通、脑梗塞见上述症候者。,
妇元栓（舒安卫生栓）,http://img1.pharmnet.com.cn/suppliers/product_cn/205571_1.jpg,,国药准字Z20000132,1.5g/粒,清热燥湿、杀虫止痒。用于霉菌性阴道炎、细菌性阴道炎、湿热下注证候。证见白带增多，外阴瘙痒，或见小便短少黄赤等。,舒安卫生栓是从民间挖掘的一种良好妇科验方，运用中医药“内病外治”的理论为基础，以君药寮刁竹为主，燥湿、杀虫、止痒、止痛；臣药两面针、蛇床子可通络、消肿止痛，再佐以大黄、野菊花、甘草等清热解毒、利湿消炎，达到“内病外治”的目的，更适用于阴道炎、阴痒、带下等症。舒安卫生栓存在处方先进、配方合理，基质新型，熔点接近体温，纳入阴道后能迅速软化溶解，起到润滑作用等优点。舒安卫生栓在疗效上虽为纯中药制剂，但却有极强的杀菌能力，既能杀灭病原体，又能保护有益菌体，保护阴道内的酸碱平衡。独特功效：①纯中药制剂由寮刁竹、两面针、甘草、蛇床子、野菊花等中药精制而成，对治疗因外感风热湿毒、下注阴部或感染病虫、虫蚀阴中而致的阴痒、阴痛、带下有极强的治疗效果，是一种具有消炎、止痛、杀虫、止痒、抑菌、消肿的纯中药制剂。②极强的杀菌能力能迅速有效地样灭金黄色葡萄球菌、乙型血性链球菌、白色念珠菌、大肠杆菌、衣原体及乳头瘤病毒等感染的阴道炎。③快速杀虫功能快速杀灭阴道滴虫、精虫(精子)、是疗效肯定的纯中药避孕药剂。
三维亚铁咀嚼片（福雪）,http://img1.pharmnet.com.cn/suppliers/product_cn/205586_1.jpg,Trivitamins Ferrous Chewable Tablets,国药准字H35021203,铝塑包装,适用于各种缺铁性贫血。,国家医保目录品种广谱的补血药含铁量高、起效快副作用小、应用方便
喘息灵胶囊,http://img1.pharmnet.com.cn/suppliers/product_cn/205588_1.jpg,,国药准字Z35020027,每粒0.29克。,平喘，止咳，祛痰。用于急、慢性支气管炎，支气管哮喘等。,喘息灵为中西药复合型药物，迅速去除咳、喘、痰的症状，并控制以上症状的发作。因长期反复咳、喘的根源由于肾、肺、脾三个器官的虚弱所致，喘息灵中的中药配方发挥固本扶元之功效，对反复咳、喘可取得满意之疗效。
蛇胆川贝液（千福牌）,http://img1.pharmnet.com.cn/suppliers/product_cn/205663_1.jpg,,国药准字Z45022209,10ml*6支/盒,祛风止咳，除痰散结。用于肺热咳嗽，痰多，气喘，胸闷，咳痰不爽或久咳不止。,"千福牌蛇胆川贝液选用优质的平贝母,蛇胆汁,杏仁水,蜂蜜等药材，应用最新的工艺和自动化的生产设备精心制备而成。"
肝必复软胶囊,http://img1.pharmnet.com.cn/suppliers/product_cn/205570_1.jpg,,国药准字Z20050572,每粒装0.5g(含树舌灵芝多糖70mg),具有免疫调节功能，可促使乙型肝炎表面抗原转阴。用于治疗乙型肝炎。,【性状】本品为软胶囊剂，内容物为棕褐色至黑褐色混悬液，气微香，味微苦。【贮藏】密封，置阴凉、干燥处保存。【有效期】暂定二年
妇炎康软胶囊,http://img1.pharmnet.com.cn/suppliers/product_cn/205569_1.jpg,,国药准字Z20050571,每粒装0.5g。,活血化瘀、软坚散结、清热解毒、消炎止痛。用于慢性附件炎、盆腔炎、阴道炎、膀胱炎、慢性阑尾炎、尿路感染。,妇炎康软胶囊是临床应用多年疗效确切的纯中药制剂妇炎康片的改剂型制剂。可针对治疗因湿热外邪入内，气血郁滞而引起的瘀血经闭和妇科炎症如慢性附件炎，盆腔炎，阴道炎，膀胱炎，慢性阑尾炎，尿路感染。本品具有明显的高纤维蛋白溶解酶的活性，促进粘膜愈合，有效防止炎症复发；消除下腹坠涨、腰骶酸痛、神疲乏力等慢性妇科炎症症状；崩解吸收快，生物利用度高；服用方便。
女珍颗粒,http://img1.pharmnet.com.cn/suppliers/product_cn/205455_1.jpg,,国药准字Z20050205,每袋装6g,滋肾，宁心。用于更年期综合征属肝肾阴虚、心肝火旺证者，可改善烘热汗出，五心烦热，心悸，失眠。,
妇炎清（双唑泰栓）,http://img1.pharmnet.com.cn/suppliers/product_cn/205572_1.jpg,,国药准字H20059708,每枚含甲硝唑200毫克，克霉唑160毫克、醋酸氯己定8毫克。,用于细菌性阴道病、念珠菌性外阴阴道炎、滴虫性阴道炎以及混合感染性阴道炎。,【性状】本品为乳黄色鸭嘴形或弹头形栓剂。【作用类别】本品为妇科用药类非处方药药品。【药理作用】本品所含甲硝唑为抗厌氧菌与抗滴虫药；克霉唑为广谱抗真菌药，对浅表、深部的多种真菌均有抗菌作用，其作用机制是抑制真菌细胞膜的合成和影响其代谢过程；醋酸氯已啶为季铵盐类阳离子表面活性剂，对革兰阳性细菌有较强杀菌作用。三药合用具有协同作用，不仅适用于单纯真菌、细菌或滴虫感染，也适用于混合感染。【禁忌】1、对本品过敏者禁用。2、孕妇禁用。
解郁安神颗粒,http://img1.pharmnet.com.cn/suppliers/product_cn/205119_1.jpg,,国药准字Z20033215,,"舒肝解郁,定神定志.用于情志不舒,肝郁气滞,等精神刺激所致的心烦,焦虑,失眠,健忘,更年期症候群,神经官能症等.",
金骨莲胶囊,http://img1.pharmnet.com.cn/suppliers/product_cn/205742_1.jpg,Jingulian Jiaonang,国药准字Z20025102,每粒装0.25克 12粒/板×1板/小盒×2小盒/中盒,祛风除湿，消肿止痛。用于风湿痹阻所致的关节肿痛，屈伸不利。,注意事项：1、忌寒凉，辛辣及油腻食物。2、本品宜饭后服用。3、不宜在服药期间同时服用其他泻火及滋补性中药。4、热痹者不适用，主要表现为关节肿痛如灼，痛处发热，疼痛窜痛无定处，口干舌燥。5、有高血压，心账病、肝病、糖尿病、肾病等慢性病严重者应在医师指导下服用。6、服药7天后无缓解，应去医院就疹。7、严格按照用法用量服用，年老体弱者应在医师指导下服用。8、对本品过敏者禁用。9、药品行状发生改变时禁止服用。10、请将药品放在儿童不能接触到的地方。11、如正在服用其他药品，使用本品前请咨询医师或药师。不良反映：个别患者服药后会有食道哽阻，不适之感，或胃肠不适感。
心可宁胶囊,http://img1.pharmnet.com.cn/suppliers/product_cn/205118_1.jpg,,国药准字Z20053193,,活血散瘀，开窍止痛。用于冠心病，心绞痛，胸闷，心悸，眩晕,
断血流口服液,http://img1.pharmnet.com.cn/suppliers/product_cn/205117_1.gif,,国药准字Z20030020,,凉血止血。适用于血热妄行的出血证候，用于功能性子宫出血，产后出血，子宫肌瘤出血，单纯性紫癜，原发性血小板减少性紫癜系血热妄行者,
颐神颗粒,http://img1.pharmnet.com.cn/suppliers/product_cn/205115_1.jpg,,国药准字B20020407,,"补益肝肾,健脾益气,宁心安神.用于肝肾不足,脾气虚弱,见有腰膝酸软,神疲力倦,头晕目眩,心悸失眠等,也可用于癌症放化疗的辅助治疗.",
复方锌布颗粒,http://img1.pharmnet.com.cn/suppliers/product_cn/205730_1.jpg,复方锌布颗粒,国药准字H19983222,3g/包,用于治疗非细菌感染引起的普通感冒及流行性感冒。,本品为复方制剂，其组分为：每包内含葡萄糖酸锌100mg、马来酸氯苯那敏2mg、布洛芬150mg。【性状】本品为白色或淡黄色颗粒，味甜。【药理毒理】本品具有良好的解热、镇痛、消炎、抗过敏作用。能抑制鼻病毒、单纯疱疹病毒等病毒复发，抑制嗜酸细胞释放组织胺。【用法用量】口服。1.成人：一日3次，一次1-2包。成人一日最大量不超过6包。每次疗程不超过7天。2.儿童：儿童酌减。儿童一日不超过3包，每次疗程不超过7天。【不良反应】偶有嗜睡及胃部不适。【禁忌】对本品过敏者禁用。【注意事项】温开水冲服(40℃以下)。【孕妇及哺乳期妇女用药】尚不明确。【药物相互作用】尚不明确。【贮藏】在阴凉干燥处保存。【有效期】二年【生产企业】上海绿谷制药有限公司
疏风散热胶囊,http://img1.pharmnet.com.cn/suppliers/product_cn/205740_1.jpg,ShuFeng SanRe Jiaonang,国药准字Z52020313,每粒装0.25g 12粒每板*2板/盒,清热解毒、疏风散热。用于风热感冒、发热头痛、咳嗽口干、咽喉疼痛。,【成份】金银花、连翘、忍冬藤、桔梗薄荷、牛蒡子、地黄、淡竹叶、甘草、淡豆豉、荆芥、栀子。【性状】本产品为胶囊剂，内容物为黄宗色粉末：气香，味微苦、微甜。【用法用量】口服，一次3-4粒，一日3次【禁用】【注意事项】详见说明书。零售价：16.8元
心胃止痛胶囊,http://img1.pharmnet.com.cn/suppliers/product_cn/205741_1.jpg,XinWei ZhiTong Jiaonang,国药准字Z20025661,每粒装0.25g 12粒每板*2板/盒,行气止痛。用于气滞血瘀所致的胃腕痛，嗳气吞酸，胀满及胸闷胸痛，心悸气短。,【成份】大果木姜子、冰片(天然冰片)【性状】本产品为胶囊剂，内容物为灰宗色至深宗色的粉末：气芳香，味微苦、辛。【用法用量】口服，一次2粒，一日3次：饭前或饭中服用，7天为一疗程。【注意事项】详见说明书。零售价：36.50元
马兰感寒胶囊,http://img1.pharmnet.com.cn/suppliers/product_cn/205743_1.jpg,MaLan GanHan Jiaonang,国药准字Z20025815,每粒装0.25g 12粒每板*2板/盒,解表散寒，宣肺止咳、用于治疗风寒感冒出现的头痛，恶寒发热、流涕咳嗽。,【成份】马兰草、铁筷子、石吊兰、紫苏叶、蓝布正、荆芥、云实皮。【【性状】本产品为胶囊剂，内容物为宗色的粉末：气微香，味微苦。【用法用量】口服，一次4-6粒，一日3次：饭前或饭中服用。
