title,img,英文名称,批准文号,主要规格,用途,产品说明
德都红花七味散,http://img1.pharmnet.com.cn/suppliers/product_cn/842/,,国药准字Z15020391,3g×5袋/盒。,清血热。用于肝瘀血热，肝区疼痛，目肤发黄，尿黄。,【药品名称】通用名称：德都红花七味散(德都古日古木-7)汉语拼音：DedouHonghuaQiweiSan【成份】红花、麻黄、石膏、木通、紫花地丁、诃子、蓝盆花。【性状】本品为浅褐色粉末；气微香，味苦。【功能主治】清血热。用于肝瘀血热，肝区疼痛，目肤发黄，尿黄。【用法用量】口服，一次1.5～3g，一日1～2次。【不良反应】尚不明确。【禁忌】尚不明确。【注意事项】运动员慎用。【贮藏】密闭，防潮。【包装】复合膜袋，3g×5袋/盒。【有效期】36个月。【执行标准】卫生部药品标准(蒙药分册)ZZ-8425【批准文号】国药准字Z15020391
清咽六味散,http://img1.pharmnet.com.cn/suppliers/product_cn/845/,,国药准字Z15020428,1.5克/袋×4袋/盒。,理肺，清咽。用于外感咳嗽，失音声哑，咽喉肿痛,[药品名称]通用名称：清咽六味散(高勒图宝日-6)汉语拼音：QingyanLiuweiSan[成份]丁香、石膏、甘草、木香、诃子、玉簪花。[性状]本品为浅黄色粉末；气芳香，味甘，微辛。[功能主治]理肺，清咽。用于外感咳嗽，失音声哑，咽喉肿痛。[用法用量]口服，一次1.5～3克，一日1～2次。[不良反应]尚不明确。
三臣丸,http://img1.pharmnet.com.cn/suppliers/product_cn/840/,,国药准字Z15020429,35粒×2瓶/盒。,熄风降火。用于小儿瘟热高烧，肺热咳嗽，各种惊风。,产品型号:三臣丸发表时间：2010-11-299:36:19核准日期：2007年05月31日三臣丸说明书请仔细阅读说明书并在医师指导下使用【药品名称】通用名称：三臣丸(图喜木勒-3)汉语拼音：SanchenWan【成份】人工牛黄、红花、天竺黄。【性状】本品为红色水丸，除去包衣显黄色；气香，味苦、微甘。【功能主治】熄风降火。用于小儿瘟热高烧，肺热咳嗽，各种惊风。【规格】每25粒重1g。【用法用量】口服，满一月小儿，一次3粒，逐月增加1粒，满一周岁小儿，一次服15粒，两岁以上儿童遵医嘱。【不良反应】尚不明确。【禁忌】尚不明确。【注意事项】尚不明确。【贮藏】密闭，防潮。【包装】高密度聚乙烯瓶，35粒×2瓶/盒。【有效期】36个月【执行标准】卫生部药品标准(蒙药分册)ZZ-9289【批准文号】国药准字Z15020429
五味沙棘散,http://img1.pharmnet.com.cn/suppliers/product_cn/843/,,国药准字Z20026152,3克×5袋/盒。,清热祛痰，止咳定喘。用于肺热久嗽，喘促痰多，胸中满闷，胸胁作痛；慢性支气管炎见上述证候者。,[药品名称]通用名称：五味沙棘散汉语拼音：WuweiShajiSan[成份]沙棘膏、木香、白葡萄干、甘草、栀子。[性状]本品为深棕色的粉末；气香，味酸、甘而苦、涩。[功能主治]清热祛痰，止咳定喘。用于肺热久嗽，喘促痰多，胸中满闷，胸胁作痛；慢性支气管炎见上述证候者。[用法用量]口服。一次3克，一日1～2次[药物相互作用］如与其他药物同时使用可能会发生药物相互作用，详情请咨询医师或药师。[贮藏]密封。[包装]复合膜袋，3克×5袋/盒。[有效期]36个月[执行标准]中成药地标升国标部分(内科肺系二分册)WS-10816(ZD-0816)-2002[批准文号]国药准字Z20026152[说明书修订日期]2007年11月16日
云香十五味丸,http://img1.pharmnet.com.cn/suppliers/product_cn/838/,,国药准字Z15020408,75粒/瓶。,燥“协日乌素”，消“粘”，消肿。用于风湿性关节炎，类风湿，“巴木”病，游痛症，疮疡，梅毒。,【药品名称】通用名称：云香十五味丸(嘎日迪-15)汉语拼音：YunxiangShiwuweiWan【成份】制草乌、木香、石菖蒲、诃子、栀子、川楝子、决明子、苘麻子、枫香脂、五灵脂、文冠木、瞿麦、黑云香、沉香、人工麝香。【性状】本品为棕褐色水丸；气微，味苦、微涩。【功能主治】燥“协日乌素”，消“粘”，消肿。用于风湿性关节炎，类风湿，“巴木”病，游痛症，疮疡，梅毒。【规格】每10粒重2g【用法用量】口服，一次9～15粒，一日1～2次，或遵医嘱。【不良反应】尚不明确。【禁忌】孕妇忌服。【注意事项】1、运动员慎用。2、本品含乌头碱，应严格在医生指导下按规定量服用。不得任意增加服用量和服用时间。服药后如果出现唇舌发麻、头痛头昏、腹痛腹泻、心烦欲呕、呼吸困难等情况，应立即停药并到医院就治。有文献报道酒能增加乌头类药物的毒性而易导致中毒。【贮藏】密闭，防潮。【包装】高密度聚乙烯瓶，75粒/瓶。【有效期】36个月
玉簪清咽十五味,http://img1.pharmnet.com.cn/suppliers/product_cn/1727806_1.jpg,,国药准字Z20053199,每10粒重2g,清“巴达干”热。用于咽喉肿痛，气喘，音哑，胸肋刺痛。,【药品名称】通用名称：玉簪清咽十五味丸（哈斯哈图呼日-15）汉语拼音：YuzanQingyanShiwuweiWan【成份】玉簪花、川楝子、广枣、檀香、石膏、北沙参、诃子、苦参、栀子、丁香、沉香、肉豆蔻、甘草、木香、瞿麦。【性状】本品为棕黄色的水丸；气芳香，味甘、微涩。【功能主治】清“巴达干”热。用于咽喉肿痛，气喘，音哑，胸肋刺痛。【规格】每10粒重2g。【用法用量】口服，一次10～15粒，一日1～2次。【不良反应】尚不明确。【禁忌】尚不明确。【注意事项】尚不明确。【贮藏】密闭，防潮。【包装】铝塑包装，30粒×2板/盒。【有效期】36个月【执行标准】国家药品标准YBZ01872005【批准文号】国药准字Z20053199
暖宫七味丸,http://img1.pharmnet.com.cn/suppliers/product_cn/820/,,国药准字Z15020399,每10粒重2克,调经养血，温暖子宫，驱寒止痛。用于心、肾“赫依”病，气滞腰痛，小腹冷痛，月经不调，白带过多。,[药品名称]通用名称：暖宫七味丸(苏格木勒-7)汉语拼音：NuangongQiweiWan[成份]白豆蔻、天冬、手掌参、沉香、肉豆蔻、黄精、丁香。[性状]本品为棕褐色的水丸；气芳香，味辛、甘。[功能主治]调经养血，温暖子宫，驱寒止痛。用于心、肾“赫依”病，气滞腰痛，小腹冷痛，月经不调，白带过多。[规格]每10粒重2克[用法用量]口服，一次11～15粒，一日1～2次。[不良反应]尚不明确。[禁忌]孕妇忌服。[注意事项]1.忌食寒凉、生冷食物。2.感冒时不宜服用本药。3.忌气恼劳碌。4.平素月经量正常，突然出现经量过多、经期延长、月经后错、经量过少，须去医院就诊。5.经期延长，月经量过多合并贫血者，应在医师指导下服用。6.青春期少女及更年期妇女应在医师指导下服用。7.一般服药一个月经周期，其症状无改善，或月经量过多，或经水淋漓不净超过半个月，或出现其他症状者，应去医院就诊。8.对本品过敏者禁用，过敏体质者慎用。9.本品性状发生改变时禁止使用。10.请将本品放在儿童不能接触的地方。11.如正在使用其他药品，使用本品前请咨询医师或药师。[药物相互作用］如与其他药物同时使用可能会发生药物相互作用，详情请咨询医师或药师。[贮藏]密闭，防潮。[包装]高密度聚乙烯瓶，75粒/瓶。[有效期]36个月[执行标准]卫生部药品标准(蒙药分册)ZZ-8422[批准文号]国药准字Z15020399[说明书修订日期]2007年04月24日[生产企业]企业名称：内蒙古蒙药股份有限公司生产地址：通辽市通郑公路18号邮政编码：028007电话号码：0475-8435678传真号码：0475-8423074注册地址：通辽市通郑公路18号网址：www.mwmy.com如有问题可与生产企业联系
健胃十味丸,http://img1.pharmnet.com.cn/suppliers/product_cn/835/,,国药准字Z15020441,每10粒重2克,暖胃助消。用于寒热积聚，消化不良，胃胀不适，呕吐泄泻。,药品名称]通用名称：健胃十味丸(浩道敦-10)汉语拼音：JianweiShiweiWan[成份]石榴、白豆蔻、诃子、光明盐、肉桂、五灵脂、胡椒、山柰、荜茇、寒水石(热制)。[性状]本品为浅棕色的水丸；气香，味辛、咸。[功能主治]暖胃助消。用于寒热积聚，消化不良，胃胀不适，呕吐泄泻。[规格]每10粒重2克[用法用量]口服，一次9～15粒，一日1～2次。[不良反应]尚不明确。
四氢吡咯,http://img1.pharmnet.com.cn/suppliers/product_cn/910/1727910_1.gif,,,分子量71.12216,用于制备药物、杀菌剂、杀虫剂等,产品介绍:CASNo:123-75-1外观:无色至浅黄色透明液体含量:≥99.9%产品用途:用于制备药物、杀菌剂、杀虫剂等
祛痛橡胶膏 嘎日迪-5,http://img1.pharmnet.com.cn/suppliers/product_cn/1728442_1.jpg,Qutong Xiangjiao Gao,国药准字Z20063427,5cm×6cm,消肿、止痛、燥“协日乌素”。用于风湿性关节炎，游痛症，腰酸腿痛。,
曲安奈德新霉素贴片,http://img1.pharmnet.com.cn/suppliers/product_cn/1728441_1.gif,Trianmcinolone Acetonide and Neomycin Paste,国药准字H15021086,1.6.5cm*4cm 2.6.5cm*10cm,用于局限性神经性皮炎，慢性湿疹。也可用于小面积的银屑病。,主要成份：本品为复方制剂，其组份每片（贴）含醋酸曲安奈德不少于16μg，硫酸新霉素不少于90单位。本品中的醋酸曲安奈德，为肾上腺皮质激素类药，外用有抗炎、抗过敏及止痒作用。能消除局部非感染性炎症引起的发热、发红及肿胀。硫酸新霉素为氨基酸糖苷类抗生素，本品对葡萄球菌属（甲氧西林敏感株）、棒状杆菌属有良好作用，对大肠埃希菌、克雷伯竣、变形杆菌属等肠杆菌科细菌亦有良好作用，对各组链球菌，肺炎链球菌、肠球菌属等活性差，铜绿加单胞菌、厌氧菌等对本品耐药。细菌连对链霉素、新霉素、卡那霉素和庆大霉素间有部分或完全交叉耐药。
复方硫磺乳膏,http://img1.pharmnet.com.cn/suppliers/product_cn/1736529_1.jpg,,国药准字Z33020558,250克,解毒，杀虫，疗疮，止痒。主用于疥癣、湿疹等皮肤病及脂溢性炎。,
利巴韦林胶囊,http://img1.pharmnet.com.cn/suppliers/product_cn/1736530_1.jpg,,国药准字H33021788,0.15g/粒,适用于呼吸道合胞病毒引起的病毒性肺炎与支气管炎，皮肤疱疹病毒感染。,用法用量口服1．病毒性呼吸道感染：成人一次0.15g，一日3次，疗程7天。2．皮肤疱疹病毒感染：成人一次0.3g，一日3次，疗程7天。3．小儿每日按体重10mg/kg，分4次服用，疗程7天。6岁以下小儿口服剂量未定。适应症适用于呼吸道合胞病毒引起的病毒性肺炎与支气管炎，皮肤疱疹病毒感染。注意事项1．有严重贫血、肝功能异常者慎用。2．对诊断的干扰：口服本品后引起血胆红素增高者可高达25%。大剂量可引起血红蛋白含量下降。3．尽早用药。呼吸道合胞病毒性肺炎病初3日内给药一般有效。本品不宜用于未经实验室确诊为呼吸道合胞病毒感染的患者。4．长期或大剂量服用对肝功能、血象有不良反应。
小儿五维赖氨酸糖浆,http://img1.pharmnet.com.cn/suppliers/product_cn/1736521_1.jpg,,国药准字H20067485,60ml,用于儿童因缺乏维生素与赖氨酸所引起的各种疾病。,注意事项1.高氯血症、酸中毒及肾功能不全患者慎用。2.对本品过敏者禁用，过敏体质者慎用。3.本品性状发生改变时禁止使用。4.请将本品放在儿童不能接触的地方。5.儿童必须在成人监护下使用。6.如正在使用其他药品，使用本品前请咨询医师或药师。
马来酸依那普利胶囊,http://img1.pharmnet.com.cn/suppliers/product_cn/1736525_1.jpg,,国药准字H10960145,5mg*36,本品为血管紧张素转换酶抑制剂。口服后在体内水解成依那普利拉(Enalaprilat)，后者强烈抑制血管紧张素转换酶，降低血管紧张素Ⅱ含量，造成全身血管舒张，引起降压。本品对Ⅱ肾型高血压、Ⅰ肾型高血压及原发性高血压大鼠模型均有明显降压作用。本品具有保护心脏作用，是治疗原发性高血压的安全选择。,用法用量口服。开始剂量为一日5mg～10mg，分1～2次服，肾功能严重受损病人(肌酐清除率低于30ml/min)为一日2.5mg。根据血压水平，可逐渐增加剂量。一般有效剂量为一日10～20mg，每日最大剂量一般不宜超过40mg，可与其它降压药特别是利尿剂合用，降压作用明显增强，但不宜与潴钾利尿剂合用。适应症用于治疗原发性高血压。注意事项可有头昏、头痛、嗜睡、口干、疲劳、上腹不适，恶心、胸闷、咳嗽、蛋白尿、皮疹、面红等。必要时减量。如出现白细胞减少，需停药。1.个别病人，尤其是在应用利尿剂或血容量减少者，可能会引起血压过度下降，故首次剂量宜从2.5mg开始。2.定期作白细胞计数和肾功能及血钾测定。
安嗽糖浆,http://img1.pharmnet.com.cn/suppliers/product_cn/1736523_1.jpg,,国药准字Z33020556,120ml,润肺化痰，止咳平喘。用于痰热阻肺，喘息气短，咳嗽痰粘，口喝咽干。,注意事项1.服药期间忌食辛辣、油腻食物。2.本品适用于痰热阻肺，其表现为气粗喘促，喉中痰鸣如吼，咯吐不利，口渴喜饮。3.哮喘急性发作，伴呼吸困难、心悸、紫绀者，或是喘息明显，表现为端坐呼吸者，或是哮病持续状态等均应去医院诊治。4.本品含氯化铵、盐酸麻黄碱。运动员慎用；肝肾功能异常者及老年患者慎用；青光眼、前列腺肥大患者应在医师指导下使用；服用后如有头晕、头痛、心动过速、多汗等症状应咨询医师或药师。5.心脏病、糖尿病患者慎用。6.儿童、体质虚弱者及脾胃虚寒者慎用。7.服药期间，若患者出现高热，体温超过38℃，或是喘促气急加重，痰量明显增多者应到医院就诊。8.本品不宜长期服用，服用3天病证无改善，应停止服用，去医院就诊。9.对本品过敏者禁用，过敏体质者慎用。10.本品性状发生改变时禁止使用。11.儿童必须在成人监护下使用。12.请将本品放在儿童不能接触的地方。13.如正在使用其他药品，使用本品前请咨询医师或药师。
贝诺酯分散片,http://img1.pharmnet.com.cn/suppliers/product_cn/1736526_1.jpg,,国药准字H20000397,0.5g×20片,用于普通感冒或流行性感冒引起的发热，也用于缓解轻至中度疼痛如头痛、关节痛、偏头痛、牙痛、肌肉痛、神经痛、痛经。,适应症用于普通感冒或流行性感冒引起的发热，也用于缓解轻至中度疼痛如头痛、关节痛、偏头痛、牙痛、肌肉痛、神经痛、痛经。注意事项1.本品为对症治疗药，用于解热连续使用不超过3天，用于止痛不超过5天，症状未缓解请咨询医师或药师。2.不能同时服用其他含有解热镇痛药的药品（如某些复方抗感冒药）。3.服用本品期间不得饮酒或含有酒精的饮料。4.儿童、孕妇及哺乳期妇女应在医师指导下使用。5.肝肾功能不全及有严重胃、肠溃疡病史者慎用。6.如服用过量或出现严重不良反应，应立即就医。7.对本品过敏者禁用，过敏体质者慎用。8.本品性状发生改变时禁止使用。9.请将本品放在儿童不能接触的地方。10.儿童必须在成人监护下使用。11.如正在使用其他药品，使用本品前请咨询医师或药师。
盐酸羟胺,http://img1.pharmnet.com.cn/suppliers/product_cn/155/1774155_1.jpg,Hydroxylamine hydrochloride,,白色结晶，易潮解，溶于水、乙醇、甘油，不溶于乙醚。,本品主要用作还原剂和显像剂，有机合成中用于制备肟，也用作合成抗癌药（羟基脲）、磺胺药（新诺明）、抗感冒药和和农药（灭多威）的原料。电分析中用作去极剂，在合成橡胶工业中用作不着色的短期中止剂等。,分子式NH2OH
硝基甲烷,http://img1.pharmnet.com.cn/suppliers/product_cn/156/1774156_1.jpg,Nitromethane,,无色透明液体，水溶液呈酸性，部分溶于水和乙醇。,本品可用作纤维素化合物、聚合物、树酯、涂料、蜡制物等的溶剂及助燃剂、表面活性剂，是制备氯化苦的原料。也可制取火箭、赛车燃料、医药、染料、杀虫剂和汽油添加剂等。,分子式：CH3NO2分子量：61理化性质：无色透明液体，水溶液呈酸性，部分溶于水和乙醇。比重(20/20oC)：1.139沸点:101.2oC凝固点：-29oC闪点：95°F(35οC)自燃温度：785F折射率(20/D)1.3817用途：本品可用作纤维素化合物、聚合物、树酯、涂料、蜡制物等的溶剂及助燃剂、表面活性剂，是制备氯化苦的原料。也可制取火箭、赛车燃料、医药、染料、杀虫剂和汽油添加剂等。产品质量：执行标准HG2031-91指标名称规格一规格二规格三外观无色或微黄色透明液体无色透明液体无色透明液体含量%≥98.0099.0099.90水分%≤1.000.500.10酸度%≥0.100.050.03
舒康贴膏,http://img1.pharmnet.com.cn/suppliers/product_cn/1748195_1.jpg,,国药准字Z20003247,9.6×11.6cm,活血，化瘀，止痛。用于软组织闭合性急性损伤和慢性劳损。,【功能与主治】活血，化瘀，止痛。用于软组织闭合性急性损伤和慢性劳损。【用法用量】贴患处
头孢丙烯胶囊,http://img1.pharmnet.com.cn/suppliers/product_cn/1748196_1.jpg,,国药准字H20052434,0.125g,本品用于敏感菌所致的下列轻、中度感染。上呼吸道感染，化脓性链球菌性咽炎，扁桃体炎。,本品为第二代头孢菌素类药物，具有广谱抗菌作用。该药的杀菌机制是通过与细菌细胞膜上的青霉素结合蛋白(PBPs)结合，阻碍细菌细胞壁合成，从而导致细菌的溶解死亡。
盐酸阿比多尔颗粒,http://img1.pharmnet.com.cn/suppliers/product_cn/908/1754908_1.jpg,,国药准字H20060500,0.1g/袋（以阿比多尔计）,口服。成人一次0.2g，一日3次，服用5日。,主要成份盐酸阿比多尔化学名称6-溴-4-（二甲氨甲基）-5-羟基-1-甲基-2-（苯硫甲基）-1H-吲哚-3-羧酸乙酯盐酸盐一水合物化学结构式分子式C22H25BrN2O3S
盐酸环丙沙星胶囊,http://img1.pharmnet.com.cn/suppliers/product_cn/1748198_1.jpg,,国药准字H20055191,0.5g*20粒 零售价：10.3元,1：新版国家基本药物，独家规格，新版GMP2：抗菌作用广，安全又快速3：成品出口欧盟用于敏感菌引起的：泌尿生殖系统感染，呼吸道感染，胃肠道感染，伤寒，骨和关节感染，皮肤软组织感染，败血症等全身感染,用于敏感菌引起的：泌尿生殖系统感染，呼吸道感染，胃肠道感染，伤寒，骨和关节感染，皮肤软组织感染，败血症等全身感染
康复新液,http://img1.pharmnet.com.cn/suppliers/product_cn/1748199_1.jpg,,国药准字Z15020805,30ml*2瓶  30ml*4瓶    零售价：53.2元   101元,"1：部分省份基药，医保独家规格，新版GMP2：创伤、溃疡修复专家3：全科用药，内服兼外用十二指肠溃疡,胃溃疡,口腔溃疡，肺结核,烧伤,烫伤,烧伤，体表溃疡（糖尿病、放射性溃疡),宫颈糜烂、阴道炎等",通利血脉，养阴生肌。内服：用于瘀血阻滞，胃痛出血，胃、十二指肠溃疡以及阴虚肺痨，肺结核的辅助治疗。外用：用于金疮、外伤、溃疡、瘘管、烧伤、烫伤、褥疮之创面。
注射用磺苄西林钠,http://img1.pharmnet.com.cn/suppliers/product_cn/1748194_1.jpg,,国药准字H21023516（辽宁科泰生物基因制药股份有限公司生产）,1.0g /瓶 零售价：82元/瓶,1：国家医保乙类，新版GMP2：经典的广谱半合成青霉素3：抗菌普更广，疗效更显著，临床一线用药主要适用于对本品敏感的铜绿假单胞菌、某些变形秆菌属以及其他敏感革兰氏阴性菌所致肺炎、尿路感染、复杂性皮肤软组织感染和败血症等。对本品敏感菌所致腹腔感染、盆腔感染宜与抗厌氧菌药物联合应用。,静脉滴注，也可静脉注射；中度感染成人一日剂量8g，重症感染或铜绿假单胞菌感染时剂量需增至一日20g，分4次静脉给药；儿童根据病情每日剂量按体重80～300mg/kg，分4次给药。
注射用盐酸头孢甲肟,http://img1.pharmnet.com.cn/suppliers/product_cn/1748193_1.JPG,,国药准字H20080087,0.5g,本品适用于头孢甲肟敏感的链球菌属(肠球菌除外)、肺炎链球菌、消化球菌属、消化链球菌属、大肠杆菌、柠檬酸杆菌属、克雷伯菌属、肠杆菌属、沙雷菌属、变形菌属、流感嗜血杆菌、拟杆菌属等引起的下述感染症：,本品适用于头孢甲肟敏感的链球菌属(肠球菌除外)、肺炎链球菌、消化球菌属、消化链球菌属、大肠杆菌、柠檬酸杆菌属、克雷伯菌属、肠杆菌属、沙雷菌属、变形菌属、流感嗜血杆菌、拟杆菌属等引起的下述感染症：1.肺炎、支气管炎、支气管扩张合并感染、慢性呼吸系统疾病的继发感染；肺脓肿、脓胸；2.肾盂肾炎、膀胱炎；前庭大腺炎、子宫内膜炎、子宫附件炎、盆腔炎、子宫旁组织炎；3.胆管炎、胆囊炎、肝脓肿；腹膜炎；4.烧伤、手术创伤的继发感染；5.败血症，脑脊膜炎等。
头孢克肟分散片,http://img1.pharmnet.com.cn/suppliers/product_cn/1748192_1.jpg,,国药准字H20061237,50mg*10片  零售价：22.4元,1：国家医保乙类2：分散片服用方便，更适用于儿童和老人3：国内百强企业，上海新亚药业闵行生产本品适用于对头孢克肟敏感的链球菌属(肠球菌除外)，肺炎球菌，淋球菌，卡他布兰汉球菌，大肠杆菌，克雷伯杆菌属及流感杆菌等引起的下列细菌感染性疾病：1、志气管炎，支气管扩张症(感染时)，慢性呼吸系统感染疾病的继发感染，肺炎；2、肾盂肾炎,本品为类白色片。
注射用甲磺酸培氟沙星,http://img1.pharmnet.com.cn/suppliers/product_cn/1748191_1.JPG,,国药准字H20056050,0.4g,功能主治：由培氟沙星敏感菌所致的各种感染。,主要成份：本品主要成份为甲磺酸培氟沙星。性状：本品为白色块状物。
O-甲基异脲素·硫酸盐溶液,http://img1.pharmnet.com.cn/suppliers/product_cn/158/1774158_1.jpg,,,无色或微黄色粘稠状液体,,别名：O-甲基异脲半硫酸盐1、分子式：C2H6N2O•1/2H2SO42、分子量：186CAS:52328-05-93、性质：易溶于水和乙醇，外观：无色或微黄色粘稠状液体用途：有机合成中间体4、包装：225Kg桶装5.用途：用于合成氟脲嘧啶类抗肿瘤药、咪唑类驱虫药及新型除草剂等
注射用卡络磺钠,http://img1.pharmnet.com.cn/suppliers/product_cn/1748190_1.JPG,,国药准字H20055417,40mg、20mg,用于泌尿系统、上消化道、呼吸道和妇产科疾病出血。对泌尿系统出血疗效较为显著，亦可用于手术出血的预防及治疗等。,主要成份：卡络磺钠性状：本品为橙黄色冻干块状物或粉末；有引湿性。本品能降低毛细血管的通透性，增进毛细血管断裂端的回缩作用，增加毛细管对损伤的抵抗力、常用于毛细血管通透性增加而产生的多种出血。
硫酸二甲酯,http://img1.pharmnet.com.cn/suppliers/product_cn/157/1774157_1.jpg,Dimethyl sulfate,,无色油状,硫酸二甲酯用于制造二甲基亚砜、香草醛、氨基比林、甲氧苄氨嘧啶以及农药乙酰甲胺磷等。在农药、染料、香料工业等有机合成中可代替卤代烷作为甲基化剂。,分子式：(CH3)2SO4分子量：126.13理化性质：无色油状液体。沸点188oC(分解)。凝固点-26.8oC。比重(20/4oC)1.3322。闪点83oC（开杯），溶于乙醚、丙酮、芳香烃，微溶于二硫化碳，脂肪烃和水。用途：硫酸二甲酯用于制造二甲基亚砜、香草醛、氨基比林、甲氧苄氨嘧啶以及农药乙酰甲胺磷等。在农药、染料、香料工业等有机合成中可代替卤代烷作为甲基化剂。产品质量指标：Q/ZXL004-2006项目指标外观无色或微黄色油状液体硫酸二甲酯含量≥98%酸度≤0.5%比重（d(25/15oC)）1.3616包装方式：危险货物编号：61116UN编号：1595包装标志：剧毒品；腐蚀品包装类别：Ⅰ类包装
定坤丸,http://img1.pharmnet.com.cn/suppliers/product_cn/1748189_1.jpg,,国药准字Z22022161,12g×4袋×盒  零售价：49.8元,1：传统名方，妇科良药，补气养血，舒郁调经2：综合改善女性生理健康，提高女性生殖器官的免疫功能补气养血、舒郁调经，用于冲任虚损，气血两亏，身体瘦弱，月经不调，经期紊乱，行经腹痛，崩漏不止，腰酸腿软。,主要成份：西洋参、鹿茸（去毛）、黄芪、白术、当归、白芍、阿胶、杜仲（炒炭）、续断、香附（醋灸）、龟板（沙烫醋淬）、延胡索（醋灸）等27味。性状：本品为黑色的小蜜丸；味苦、微甜。
硝呋太尔,http://img1.pharmnet.com.cn/suppliers/product_cn/145/1775145_1.jpg,Nifuratel,,EP,原料药及其中间体,CASNO:4936-47-4分子量:285.2764ECNO:225-576-2分子式:C10H11N3O5S
3-氨基丙醇,http://img1.pharmnet.com.cn/suppliers/product_cn/no1.jpg,,,,,
